[
  {
    "id": "auto-od-niemca",
    "category": "handlarz",
    "patterns": [
      "auto od niemca",
      "od niemca",
      "niemiec płakał",
      "niemiec plakal",
      "od starszego pana",
      "od emeryta",
      "od dziadka z niemiec",
      "starszy pan jeździł",
      "starszy pan jezdzil",
      "emeryt jeździł",
      "emeryt jezdzil"
    ],
    "explanation": "Zwrot bardzo częsty w ogłoszeniach aut sprowadzanych. Sam w sobie nie oznacza problemu, ale nie da się go zweryfikować bez dokumentów z kraju pochodzenia.",
    "severity": "niska",
    "neutral_wording": "W ogłoszeniu podano informacje o poprzednim właścicielu za granicą. Do wyjaśnienia ze sprzedawcą, czy są na to dokumenty (np. poprzedni dowód rejestracyjny, historia serwisowa).",
    "question_for_seller": "Czy ma Pan/Pani dokumenty z kraju pochodzenia: poprzedni dowód rejestracyjny, umowę zakupu i historię serwisową?"
  },
  {
    "id": "serwis-aso-bez-dowodu",
    "category": "historia",
    "patterns": [
      "serwisowany w aso",
      "serwisowana w aso",
      "serwis w aso",
      "serwisowany do końca",
      "serwisowany do konca",
      "serwisowana do końca",
      "serwisowana do konca",
      "pełna historia serwisowa",
      "pelna historia serwisowa",
      "regularnie serwisowany",
      "regularnie serwisowana",
      "serwis tylko w aso",
      "książka serwisowa",
      "ksiazka serwisowa",
      "serwisowane w aso",
      "serwisowane do końca",
      "serwisowane do konca",
      "regularnie serwisowane"
    ],
    "explanation": "Deklaracja serwisu ma wartość tylko wtedy, gdy da się ją potwierdzić książką z pieczątkami, fakturami lub wydrukiem historii z ASO po numerze VIN.",
    "severity": "srednia",
    "neutral_wording": "Ogłoszenie wspomina o historii serwisowej. Do wyjaśnienia ze sprzedawcą, czy można ją zobaczyć (książka, faktury lub wydruk z ASO).",
    "question_for_seller": "Czy mogę zobaczyć książkę serwisową, faktury lub wydruk historii z ASO? Przy jakim przebiegu był ostatni wpis?"
  },
  {
    "id": "pierwszy-wlasciciel-w-pl",
    "category": "handlarz",
    "patterns": [
      "pierwszy właściciel w polsce",
      "pierwszy wlasciciel w polsce",
      "pierwszy właściciel w kraju",
      "pierwszy wlasciciel w kraju",
      "1 właściciel w kraju",
      "1 wlasciciel w kraju",
      "1 właściciel w pl",
      "1 wlasciciel w pl",
      "pierwszy właściciel w pl",
      "pierwszy wlasciciel w pl",
      "1-szy właściciel w kraju",
      "1-szy wlasciciel w kraju",
      "1-szy właściciel w pl",
      "1-szy wlasciciel w pl",
      "1 wł. w kraju",
      "1 wl. w kraju"
    ],
    "explanation": "Oznacza zwykle auto sprowadzone i zarejestrowane niedawno przez obecnego sprzedawcę. Historia sprzed rejestracji w Polsce nie jest widoczna w polskich rejestrach.",
    "severity": "niska",
    "neutral_wording": "Auto prawdopodobnie zostało sprowadzone i zarejestrowane w Polsce przez obecnego właściciela. Do wyjaśnienia ze sprzedawcą, jak długo nim jeździ i jaka jest historia sprzed importu.",
    "question_for_seller": "Jak długo jest Pan/Pani właścicielem, ile kilometrów Pan/Pani przejechał(a) i czy ma Pan/Pani dokumenty sprzed sprowadzenia?"
  },
  {
    "id": "sprowadzony-oplacony",
    "category": "dokumenty",
    "patterns": [
      "sprowadzony opłacony",
      "sprowadzony oplacony",
      "sprowadzony, opłacony",
      "sprowadzony, oplacony",
      "sprowadzona opłacona",
      "sprowadzona oplacona",
      "opłacony do rejestracji",
      "oplacony do rejestracji",
      "gotowy do rejestracji",
      "akcyza opłacona",
      "akcyza oplacona",
      "opłacone akcyza",
      "oplacone akcyza",
      "auto opłacone",
      "auto oplacone",
      "przygotowany do rejestracji",
      "/(?<!\\p{L})(sprowadzon[yae]|opłacon[yae]|oplacon[yae])(?!\\p{L}).{0,20}(?<!\\p{L})(do rejestracji|opłacon|oplacon)/iu",
      "sprowadzone opłacone",
      "sprowadzone oplacone",
      "sprowadzone, opłacone",
      "sprowadzone, oplacone"
    ],
    "explanation": "Auto nie jest jeszcze zarejestrowane w Polsce. Kupujący zostaje pierwszym właścicielem w kraju i sam je rejestruje. Ważne, kto figuruje w dokumentach jako właściciel – zdarza się, że sprzedający nie jest stroną dokumentów zakupu z zagranicy.",
    "severity": "srednia",
    "neutral_wording": "Auto czeka na pierwszą rejestrację w Polsce. Do wyjaśnienia ze sprzedawcą, kto jest właścicielem według dokumentów i jakie dokumenty kupujący otrzyma do rejestracji.",
    "question_for_seller": "Kto jest właścicielem według dokumentów z zagranicy i czy umowę podpisze osoba, która jest w nich wpisana? Jakie dokumenty otrzymam (dowód z zagranicy, umowa lub faktura, potwierdzenie akcyzy, tłumaczenia)?"
  },
  {
    "id": "negocjacje-przy-aucie",
    "category": "handlarz",
    "patterns": [
      "do negocjacji przy aucie",
      "negocjacja przy aucie",
      "negocjacje przy aucie",
      "cena do negocjacji przy aucie",
      "przy aucie negocjacja",
      "negocjuję przy aucie",
      "negocjuje przy aucie",
      "konkretna rozmowa przy aucie"
    ],
    "explanation": "Częsty zwrot w ogłoszeniach. Nie jest problemem sam w sobie, ale cena w ogłoszeniu może nie odpowiadać realnym oczekiwaniom sprzedającego.",
    "severity": "niska",
    "neutral_wording": "Sprzedający zapowiada negocjacje na miejscu. Warto przed wyjazdem ustalić orientacyjną cenę i zakres ewentualnych usterek, aby nie podejmować decyzji pod presją.",
    "question_for_seller": "Jaka jest realna cena przy założeniu, że auto jest takie jak w opisie? Czy są usterki, o których powinienem wiedzieć przed przyjazdem?"
  },
  {
    "id": "cena-do-uzgodnienia",
    "category": "cena",
    "patterns": [
      "cena do uzgodnienia",
      "cena do ustalenia",
      "cena do dogadania",
      "cena w wiadomości",
      "cena w wiadomosci",
      "cena na priv",
      "cena telefonicznie",
      "zadzwoń po cenę",
      "zadzwon po cene",
      "cena symboliczna"
    ],
    "explanation": "Brak jasnej ceny utrudnia porównanie z rynkiem; bywa stosowany w ogłoszeniach handlowych lub przy cenie wyraźnie odbiegającej od rynku.",
    "severity": "niska",
    "neutral_wording": "Ogłoszenie nie podaje jednoznacznej ceny. Do wyjaśnienia ze sprzedawcą przed oględzinami.",
    "question_for_seller": "Jaka jest cena auta i czy obejmuje ona wszystkie opłaty (np. akcyzę, rejestrację, jeśli auto jest sprowadzone)?"
  },
  {
    "id": "pilna-sprzedaz",
    "category": "inne",
    "patterns": [
      "pilne",
      "pilnie sprzedam",
      "pilna sprzedaż",
      "pilna sprzedaz",
      "szybka sprzedaż",
      "szybka sprzedaz",
      "muszę sprzedać",
      "musze sprzedac",
      "sprzedam szybko",
      "wyjazd za granicę",
      "wyjazd za granice",
      "z powodu wyjazdu",
      "sprzedaż z powodu wyjazdu",
      "sprzedaz z powodu wyjazdu",
      "dziś odbiór",
      "dzis odbior"
    ],
    "explanation": "Presja czasu sprzyja pochopnym decyzjom. Pilność bywa prawdziwa, ale w połączeniu z niską ceną i prośbą o przedpłatę jest typowa dla oszustw.",
    "severity": "niska",
    "neutral_wording": "Sprzedający informuje o pilnej sprzedaży. Warto mimo to przeprowadzić pełne oględziny i sprawdzenie dokumentów bez pośpiechu.",
    "question_for_seller": "Czy będzie możliwość spokojnych oględzin, wizyty u mechanika i sprawdzenia dokumentów przed zakupem?"
  },
  {
    "id": "sprzedaz-za-znajomego",
    "category": "dokumenty",
    "patterns": [
      "sprzedam za znajomego",
      "sprzedaję za znajomego",
      "sprzedaje za znajomego",
      "w imieniu znajomego",
      "w imieniu właściciela",
      "w imieniu wlasciciela",
      "auto kolegi",
      "auto brata",
      "auto szwagra",
      "auto taty",
      "sprzedaję auto znajomego",
      "sprzedaje auto znajomego",
      "nie jestem właścicielem",
      "nie jestem wlascicielem"
    ],
    "explanation": "Osoba wystawiająca ogłoszenie nie jest właścicielem. Umowę powinien podpisać właściciel wpisany w dowodzie lub osoba z pisemnym pełnomocnictwem.",
    "severity": "srednia",
    "neutral_wording": "Ogłoszenie wystawia osoba inna niż właściciel. Do wyjaśnienia ze sprzedawcą, kto podpisze umowę i czy jest pełnomocnictwo.",
    "question_for_seller": "Czy właściciel z dowodu rejestracyjnego będzie obecny przy podpisaniu umowy? Jeśli nie – czy jest pisemne pełnomocnictwo do sprzedaży?"
  },
  {
    "id": "zamiana",
    "category": "handlarz",
    "patterns": [
      "zamienię",
      "zamienie",
      "możliwa zamiana",
      "mozliwa zamiana",
      "rozważę zamianę",
      "rozwaze zamiane",
      "biorę w rozliczeniu",
      "biore w rozliczeniu",
      "zamiana na",
      "przyjmę auto w rozliczeniu",
      "przyjme auto w rozliczeniu",
      "zamiana dopłata",
      "zamiana doplata",
      "zamiana z dopłatą",
      "zamiana z doplata"
    ],
    "explanation": "Zamiana i rozliczenie innym autem są częstsze u osób handlujących autami; nie są problemem same w sobie.",
    "severity": "niska",
    "neutral_wording": "Sprzedający dopuszcza zamianę. To informacja o charakterze sprzedaży – warto ustalić, od kiedy sprzedający jest właścicielem.",
    "question_for_seller": "Od kiedy jest Pan/Pani właścicielem auta i ile nim przejechał(a)?"
  },
  {
    "id": "nie-wymaga-wkladu",
    "category": "stan_techniczny",
    "patterns": [
      "nie wymaga wkładu finansowego",
      "nie wymaga wkladu finansowego",
      "nie wymaga wkładu",
      "nie wymaga wkladu",
      "bez wkładu finansowego",
      "bez wkladu finansowego",
      "bez wkładu",
      "bez wkladu",
      "wsiadać i jeździć",
      "wsiadac i jezdzic",
      "wsiadać i jechać",
      "wsiadac i jechac",
      "wsiadać i jeżdzić",
      "nic nie wymaga",
      "żadnego wkładu",
      "zadnego wkladu"
    ],
    "explanation": "Ogólnik, którego nie da się zweryfikować bez oględzin. Często pojawia się przy autach z bieżącymi usterkami lub zbliżającymi się kosztownymi wymianami (rozrząd, sprzęgło).",